{
  "artifacts": {
    "sdist": {
      "entry_count": 198,
      "name": "slaif_local_coding-0.1.0.tar.gz",
      "sha256": "dc65e84f256a93eefece151f70f7ecb41f7a00f91ef40547502e2944bf34ddf8",
      "size_bytes": 1001051
    },
    "wheel": {
      "entry_count": 37,
      "name": "slaif_local_coding-0.1.0-py3-none-any.whl",
      "sha256": "1f2ebaff444be1ae90a7f1d863f462abcc82ff28caca448e28c206699fa4b50c",
      "size_bytes": 142753
    }
  },
  "frozen_publication": {
    "manifest_path": "packaging/release_provenance_manifest.json",
    "rc_identifier": "0.1.0-rc10",
    "schema": "slaif-release-provenance-v5",
    "sdist_sha256": "50325eeeaeffd91db3b6ddd996268473043ea48d9f948be23838f1f9968b3f29",
    "source_commit": "255b3f42912e3947908fc8868eccb6bcec874a08",
    "wheel_sha256": "eb241dda2e079b29190868108c488edaf98261c84119bfd405070dea98b546b9"
  },
  "objective": "016-b",
  "qualification_label": "development-source-5e7a77f22b383b0b8b4a5e14128509fe646eba52; not a release candidate; not released",
  "release": false,
  "repository": "ulfe-lmi/slaif-local-coding",
  "schema": "slaif-dev-provenance-v1",
  "schema_version": 1,
  "self_referential_exclusions": [
    "packaging/dev_provenance_manifest.json",
    "packaging/dev_provenance_manifest.schema.json"
  ],
  "source_commit": "5e7a77f22b383b0b8b4a5e14128509fe646eba52",
  "source_inputs": {
    ".dockerignore": "b82e057eebcae9bc37bdc6700a2f0fa5bd4542e5df7ef9009aebfa481dbed482",
    ".github/workflows/ci.yml": "f65f8de611245590f88ec40102a240ff5cb9e0825aa52fe7221b11d484dc2480",
    "CONTRIBUTING.md": "ef3a21206d990fcf8b586f65080a63640c2c77333a09aa152248c46a713310e6",
    "Dockerfile": "a89d6a924f119cf0a9dd6124afe47eee60fb008cbd0d2e482de9b186f2974c22",
    "INSTALL.md": "4b4ceb5159d3fa6c1d35e6aea22235d37624fdfe811e40894954d1fa35d54514",
    "LICENSE": "cfc7749b96f63bd31c3c42b5c471bf756814053e847c10f3eb003417bc523d30",
    "NOTICE": "95034243e7bde9fa107444a2c49d29966d989410498cff304cd867caf2879c3b",
    "QUICKSTART.md": "db325ea74268a57fbcff990e07537c6bc0999c0fedc99c9629199276d63d56e7",
    "README.md": "c7f87fb920cd6f0f24ad5cf6574c35441e44a6ce7538c2f93fd9a60ec3d87585",
    "THIRD_PARTY_NOTICES.md": "dfcf961bd169c5b6c3d977c912c063286728e0007481a27e18c492d3508dfc24",
    "compose.build.yaml": "954138d4831bd8abbba7100ca3364fb3180d7f39b6d309bed23e727b51359adb",
    "compose.yaml": "0928c9a66e808bb7d13118dffc22e61ce338157260b43b195ba0e7295f6332f3",
    "config/adapter.deployment.template.toml": "e4838be16ed1c5fc3f698a6e10246be61148a498ade61d0a8c11986cf42ed565",
    "config/adapter.example.toml": "a06e6aae12af6df571faaa383e40118ffa4d8f4f273310721381de2a17122fc0",
    "config/adapter.gateway-integrated.template.toml": "14357037ab96029ed510d0d491f10a9e7b51586d0f7b9b4842ac3d9937e74afb",
    "docs/ADAPTER-CONFIGURATION.md": "8da874d2036eb9de2ff99c1e9e195d856061bae5dcdeb030d766d6f6268a9e8f",
    "docs/CACHE-IMPLEMENTATION-PLAN.md": "aa13596f4efbd9f77ff637fd6af459a9e16e8ef69856e040edccbede3acedf23",
    "docs/CACHE-OBSERVATION-CONTRACT.md": "32b21e039cf2d2259b84cf48c4f07eed35798d3adf0fe7e9bfdeff09bc6d590f",
    "docs/CACHE-REWORK-LEDGER.md": "e1d3715829abd6ee4317959a133b775c012750a0f120cc2c888af27a04bc7287",
    "docs/CACHE-REWORK.md": "410df5c0b8f90b05220adc32c8e673b143c0cf1fa3da02270d91ac453c886abd",
    "docs/DEPLOYMENT.md": "1f1314dd10414299c7212e738ab321d5fc06bbe70a7f7ae843f1dcb81c5b80de",
    "docs/DEVELOPMENT-PROVENANCE.md": "6ec28720a637f7a7f8f498f70f1ed96e45e462c88b73faef833d5f29cefc8b03",
    "docs/DOCKER-INSTALL.md": "cc34ac5f4a1b18b35378bc63e899dde9c0fa792a85fd00506a39bf1d2c4fbcc8",
    "docs/DOCKER-SECURITY-DELTA.md": "c2d723ded9ba1a6282b63844f2a3794b4477122a1fc71f32fb240f9845f2fba9",
    "docs/GATEWAY-CONTRACT-CI.md": "b9c1294d88f2bd8e8902213fa82c6710c7e15fb3c8c249ade34ae3db984c4a47",
    "docs/GATEWAY-ROUTE-SCOPED-CODEX-TOOL-FILTER-PROPOSAL.md": "bc1e112b1b4ca884f406ac93c6dde5e0c71dd96e01415f5d79709556fa21cb97",
    "docs/HISTORY.md": "02728528ebbca985c98bf1306d18b8b5bcc87e9640bd4d954f80b6a558f6b81f",
    "docs/IMPLEMENTATION-ROADMAP.md": "9fe6c267afef7126d8a41a471f5320bb2d9bfcb20afbebb4f8f236b78ef06a7d",
    "docs/OBJECTIVE-004-LEDGER.md": "258e40a951672fb499f3a15e37e711e8dbc6eceab7d2ff4c2225cd0ab65df13b",
    "docs/OBJECTIVE-005D-SECURITY-CONTAINMENT.md": "602be9a7fab0b19f2713fa197117952885d38a48bcfa991597d32e749bed2d24",
    "docs/RC-HANDOFF.md": "63ab1599668e46ec2423db8e8d6f79164655abb82b1901e4a4226b71d0e35dca",
    "docs/README.md": "9ea2875a8b53034a0fb5c90367b5443a9328c9f8c83adeb6865c1e12090ca56c",
    "docs/RELEASE-ARTIFACT-POLICY.md": "16b76e5391d06779328000a550c2e38b8b84dfe8d212a6a4ba834a1b72321c98",
    "docs/RELEASE-CUTOVER-RUNBOOK.md": "e5f321463838daadc0e9754c217cfb122f228bc250d1a52bc313df36192100bc",
    "docs/TOPOLOGY.md": "7fa102ea62581692820c9cf47a3f02e1e6881dab301fa6978315550f8765b96e",
    "docs/VISION-ACCEPTANCE.md": "62b5c413d0dda505a8cd1a8a3cfbc2695582b7d8a8de29a1bb7f3c42dfa28be7",
    "docs/topology.manifest.json": "408f488f30902adbc7d88a4ef4ef4542b0a56ad1a7191856a72931dc53c27b15",
    "packaging/rc_artifact_record.schema.json": "d8333478c5715511cb6fc0fd675da335198aa8e010cc9bf5959fd6bce22a0b84",
    "packaging/readyz-wait.sh": "a667934433c32b3cb3724cf8667c9ec64f08d984a43656dd699cc46bd1f4075b",
    "packaging/slaif-local-coding.service": "b859eca1e80a373422e41327b2cdbe975d1e92fa3265b0afd0eb2c7c94373c4a",
    "packaging/slaif-local-coding.service.example": "8afbc2a9c57bde8aa4d6121cb5c383707cb848c19d0d90843b217af9bfb97eaa",
    "pyproject.toml": "b51181ea2265cfc7a5de6974999cdba9929f1030714d9cecb2584655680c65ce",
    "src/slaif_local_coding/__init__.py": "79562ee8efeb0ee91c24475d76e8a351734d6ff2e88288c1b952cbe4a508e517",
    "src/slaif_local_coding/__main__.py": "6d8b7d7846a845059d7a3107143f11131f63c5511d669b44085b15ec5e3d2279",
    "src/slaif_local_coding/app.py": "28cbff58cedce083a5aa64d663272fdb7583a7d03cfb12169384176e4b2e67f1",
    "src/slaif_local_coding/cli.py": "b301a5971e36b3bbe0627a4114e8515fdf23dac821f12e5d84bd94ad91d36335",
    "src/slaif_local_coding/config.py": "a20a089c2fe56f496425b27485be82e38935cde3bcedb3ae750aa1d5af551913",
    "src/slaif_local_coding/constitution/__init__.py": "9731277b8a4c7552a0457efd7d09f0a117e24fcad3b0df0782259363c4d0e867",
    "src/slaif_local_coding/constitution/bundles/__init__.py": "8123cca0b5b49ef3f80d3551a963824b0aaad35c42f15fdaad2d4ba1fb4cd310",
    "src/slaif_local_coding/constitution/bundles/client_paths.py": "ce4312f4e81f868076974bfbd519fc8c3a62ef2d5f30f2a5200b48078a0976e9",
    "src/slaif_local_coding/constitution/bundles/compound_reads.py": "6f857d9f2df249e4cc566be8ea13a48612af7c3a0ae4677dd20b2b34e78c82cc",
    "src/slaif_local_coding/constitution/bundles/literal_loops.py": "a6b07245969a52c4d8f73d585e43d8f4d53114396ecb0882532a1cf6119d83d6",
    "src/slaif_local_coding/constitution/bundles/observation_models.py": "d542abf3bd94c5343428f9af00c39f318aaabf8ab86d0fb0a5376942b75605ab",
    "src/slaif_local_coding/constitution/bundles/observe.py": "42d5c45b4bded12bddffa850c0130fe9d4b7fd9e7720ba90d7b5e1a15ec86712",
    "src/slaif_local_coding/constitution/bundles/read_grammar.py": "2ad0e07971274e5ccab94a8c33a1beee86d6c6fef249cbcd83f6e030bfe94f45",
    "src/slaif_local_coding/constitution/bundles/root_envelopes.py": "9212e5fe33dea102131696997da27a619667042d6c0bd51f57bde1473a801444",
    "src/slaif_local_coding/constitution/bundles/shell_tokens.py": "99161042191b2ad0d68196a440fbfc7eeb04717aea1dccbc424fffb5ab1c98f0",
    "src/slaif_local_coding/constitution/bundles/tool_results.py": "c423a20448f1b807385d14bb14f16a8d077b14e25b931b172965e303b7a71336",
    "src/slaif_local_coding/constitution/cache.py": "3836255390244ef1bd9a223319216ddbb34e87ba447600eb0da546a7fbec09cc",
    "src/slaif_local_coding/constitution/compiler.py": "d278f89adc7d2a91f0193614c30c47080f2bdd4fded7b001ba57e8c99e10ad2e",
    "src/slaif_local_coding/constitution/compiler_models.py": "468e389d8359c912ce6bf760116ad7cb10055fe12997c5bfa59b738088a04246",
    "src/slaif_local_coding/constitution/detector.py": "bc8ea20f06da82e3dee63a0c52d3bdd185798489d184b7ebf8736c9cd4c528b8",
    "src/slaif_local_coding/constitution/injection.py": "bf99442cceacc06f835ebd3742fb49738b223aeb0251908e4b4c242febdac066",
    "src/slaif_local_coding/constitution/models.py": "b1b82c1e99194ba3710baa1a5dd88ca9ff9a5740aa8083724412407a070a02df",
    "src/slaif_local_coding/constitution/pipeline.py": "933f8050bf859a3315b36891931bdef753f43cd4bb732efa30e8dbaf42570b77",
    "src/slaif_local_coding/constitution/references.py": "ba4c4b688d7d74d6f3f888f5d09c75067229e76fb1f369b56f5b30e7f6f57835",
    "src/slaif_local_coding/constitution/working_set.py": "8256e7dcf895fc2b6a5784121adaf82d10308a523d48cf614d81b15c1c529ef9",
    "src/slaif_local_coding/gateway_identity.py": "8ea6e63920d3a3e4db6d80c1bed7300cacf21e74a7e3d359583dad5694cdd4b5",
    "src/slaif_local_coding/image_policy.py": "9ede8a43dd7f897cc80a2a24d298b451a9d6446f8653cff59c0f9dcd59fda2f4",
    "src/slaif_local_coding/json_structure.py": "e8d57b3994cffe360d45377235163eb728042bd82124e6dad6fb8c3dc23ac5d2",
    "src/slaif_local_coding/py.typed": "6e0af5d87c83515710f0096c1a5dabb80bacef31e37cff9815eb6f68534cf08b",
    "src/slaif_local_coding/tool_policy.py": "cab512aad84d73c8cd43357af6de11e6ae2993543fc8d27fb9beb59065758c6b",
    "src/slaif_local_coding/upstream_diagnostics.py": "1f122a3e7925b51ec51b2fd4f5fa235c18237cce1ccbfe439dbf36c8eb651f94",
    "tests/__init__.py": "e3b0c44298fc1c149afbf4c8996fb92427ae41e4649b934ca495991b7852b855",
    "tests/fixtures/cache_bundles/v1/README.md": "cdb41d79afc2200dfcd56a8c59af94500419d52a842443463adaa21da051f6d1",
    "tests/fixtures/cache_bundles/v1/read_chat_single_complete.json": "8f6051e1c20720bb751e845f190c365371b0b19b397dae2b5cd494d9441e60f7",
    "tests/fixtures/cache_bundles/v1/read_duplicate_call_responses.json": "decb10376a1e4522a6d2a1d4a1b378011983f15916f61aba42026344cb9889da",